[
  {
    "$comment": "Generalizes the 'root reads once, everyone (including root) writes' pattern rather than the narrower 'root reads, only non-root writes' version implied by the illustrative sentence in docs/schema/semantics-formal.md. Needed because MPI_Bcast uses a single inout buffer (source_buffer==dest_buffer, root's write is a same-buffer no-op) while NCCL/NVSHMEM/SHMEM use two separate buffers and root itself also receives into a distinct recvbuff/dest. One pure-substitution template covers both by making root a member of the 'member' write participant too, rather than needing a conditional. NVSHMEM/SHMEM's byte-oriented 'mem' variant (used for these golden examples) has no runtime datatype parameter -- datatype is fixed by which typed entry this is (nvshmem_int_broadcast vs. nvshmem_broadcastmem) -- so extent.datatype_ref is bound to a literal type token ('type:byte') rather than a param: ref. See the corresponding entry in docs/cross-ppm-analysis/known-gaps-and-open-questions.md.",
    "cross_ppm_reusable": true,
    "id": "collective.one_to_all_uniform",
    "motivated_by": [
      "mpi:mpi_bcast",
      "nccl:ncclBroadcast",
      "nvshmem:nvshmem_broadcastmem",
      "shmem:shmem_broadcastmem"
    ],
    "slots": [
      {
        "kind": "buffer_slot",
        "name": "source_buffer",
        "optional": false
      },
      {
        "kind": "buffer_slot",
        "name": "dest_buffer",
        "optional": false
      },
      {
        "kind": "extent_slot",
        "name": "extent",
        "optional": false
      },
      {
        "kind": "selector_slot",
        "name": "root_selector",
        "optional": false
      },
      {
        "kind": "selector_slot",
        "name": "scope_selector",
        "optional": false
      }
    ],
    "template": {
      "data_flow": [
        {
          "buffer": "{{source_buffer}}",
          "extent": "{{extent}}",
          "id": "df_read",
          "inputs": [],
          "offset": null,
          "op": "read",
          "operation_ref": null,
          "participant": "root",
          "source": null,
          "valid_during": null
        },
        {
          "buffer": "{{dest_buffer}}",
          "extent": "{{extent}}",
          "id": "df_write",
          "inputs": [],
          "offset": null,
          "op": "write",
          "operation_ref": null,
          "participant": "member",
          "source": {
            "kind": "structural",
            "ref": "df_read"
          },
          "valid_during": null
        }
      ],
      "handle_lifecycle": [],
      "participants": [
        {
          "calls_function": true,
          "cardinality": "one",
          "id": "root",
          "role_kind": "initiator",
          "selector": "{{root_selector}}"
        },
        {
          "calls_function": true,
          "cardinality": "many",
          "id": "member",
          "role_kind": "member",
          "selector": "{{scope_selector}}"
        }
      ],
      "sync": {
        "events": [],
        "matching": {
          "kind": "collective_rendezvous",
          "match_keys": [],
          "matched_across": "all_participant_instances",
          "program_order_required": null
        },
        "ordering": []
      }
    }
  },
  {
    "$comment": "Same typed-API finding as one_to_all_uniform, plus a second instance of the same pattern: NVSHMEM/SHMEM's reduction operator (sum/min/max/...) is baked into the function name via a macro OP argument (confirmed directly in external-inputs/nvshmem/implementation/.../nvshmem_coll_api.h's NVSHMEMI_DECL_TEAM_REDUCE(NAME,TYPE,OP) and external-inputs/shmem/tex/shmem-standard/content/shmem_reductions.tex's per-operator FuncDecl list), not a runtime OPERATION-kind parameter the way MPI's op / NCCL's op are. operation_ref is bound to a literal token ('literal:sum') for NVSHMEM/SHMEM, vs. a real param: ref for MPI/NCCL.",
    "cross_ppm_reusable": true,
    "id": "collective.all_to_all_reduce",
    "motivated_by": [
      "mpi:mpi_allreduce",
      "nccl:ncclAllReduce",
      "nvshmem:nvshmem_int_sum_reduce",
      "shmem:shmem_int_sum_reduce"
    ],
    "slots": [
      {
        "kind": "buffer_slot",
        "name": "source_buffer",
        "optional": false
      },
      {
        "kind": "buffer_slot",
        "name": "dest_buffer",
        "optional": false
      },
      {
        "kind": "extent_slot",
        "name": "extent",
        "optional": false
      },
      {
        "kind": "operation_slot",
        "name": "operation",
        "optional": false
      },
      {
        "kind": "selector_slot",
        "name": "scope_selector",
        "optional": false
      }
    ],
    "template": {
      "data_flow": [
        {
          "buffer": "{{source_buffer}}",
          "extent": "{{extent}}",
          "id": "df_read",
          "inputs": [],
          "offset": null,
          "op": "read",
          "operation_ref": null,
          "participant": "member",
          "source": null,
          "valid_during": null
        },
        {
          "buffer": null,
          "extent": "{{extent}}",
          "id": "df_reduce",
          "inputs": [
            {
              "ref": "df_read",
              "scope": "all_participant_instances"
            }
          ],
          "offset": null,
          "op": "reduce",
          "operation_ref": "{{operation}}",
          "participant": null,
          "source": null,
          "valid_during": null
        },
        {
          "buffer": "{{dest_buffer}}",
          "extent": "{{extent}}",
          "id": "df_write",
          "inputs": [],
          "offset": null,
          "op": "write",
          "operation_ref": null,
          "participant": "member",
          "source": {
            "kind": "reduced",
            "ref": "df_reduce"
          },
          "valid_during": null
        }
      ],
      "handle_lifecycle": [],
      "participants": [
        {
          "calls_function": true,
          "cardinality": "many",
          "id": "member",
          "role_kind": "member",
          "selector": "{{scope_selector}}"
        }
      ],
      "sync": {
        "events": [],
        "matching": {
          "kind": "collective_rendezvous",
          "match_keys": [],
          "matched_across": "all_participant_instances",
          "program_order_required": null
        },
        "ordering": []
      }
    }
  },
  {
    "$comment": "Strongest cross-PPM evidence in this seed set -- all four PPMs, both directions (create and destroy) of the interval. nvshmem_malloc/shmem_malloc bind handle to the literal 'return_value' token per handle_lifecycle's documented convention (docs/schema/semantics-formal.md), since the handle is the function's return value, not a parameter.",
    "cross_ppm_reusable": true,
    "id": "resource.lifecycle",
    "motivated_by": [
      "mpi:mpi_win_create",
      "mpi:mpi_win_free",
      "nccl:ncclCommInitRank",
      "nccl:ncclCommDestroy",
      "nvshmem:nvshmem_malloc",
      "nvshmem:nvshmem_free",
      "shmem:shmem_malloc",
      "shmem:shmem_free"
    ],
    "slots": [
      {
        "kind": "handle_slot",
        "name": "handle",
        "optional": false
      },
      {
        "kind": "literal_slot",
        "name": "handle_kind",
        "optional": false
      },
      {
        "kind": "literal_slot",
        "name": "role",
        "optional": false
      }
    ],
    "template": {
      "data_flow": [],
      "handle_lifecycle": [
        {
          "handle": "{{handle}}",
          "handle_kind": "{{handle_kind}}",
          "role": "{{role}}"
        }
      ],
      "participants": [
        {
          "calls_function": true,
          "cardinality": "one",
          "id": "self",
          "role_kind": "initiator",
          "selector": "self"
        }
      ],
      "sync": {
        "events": [
          {
            "bound_to": "{{handle}}",
            "event_type": "point",
            "id": "lifecycle_event",
            "participant": "self"
          }
        ],
        "matching": null,
        "ordering": []
      }
    }
  },
  {
    "$comment": "MPI_Put's real signature (confirmed against external-inputs/mpi/tex/mpi-standard/apis.json) has no target-buffer parameter at all -- the remote address is resolved via (win, target_disp) against a region already registered by a separate mpi_win_create call, not a literal pointer. This binds target_buffer to the window handle itself ('param:win') rather than inventing a param: ref that doesn't exist. That is a genuine, newly-found gap: data_flow[].buffer implicitly assumes a nameable BUFFER-kind parameter, which MPI's window+displacement addressing model doesn't provide -- flagged in known-gaps-and-open-questions.md. SHMEM/NVSHMEM's symmetric-heap put has a real dest pointer and doesn't hit this. Also simplified: MPI_Put's origin and target sides can have independent count/datatype; this shape binds one shared extent from the origin side only and does not model the two diverging -- acceptable for a seed shape, called out here rather than silently assumed.",
    "cross_ppm_reusable": "partial by design -- NCCL has no one-sided API at all, matching shape-catalog.md's own catalog table (rma.put: MPI/SHMEM/NVSHMEM only). Not a gap.",
    "id": "rma.put",
    "motivated_by": [
      "mpi:mpi_put",
      "nvshmem:nvshmem_{T}_put",
      "shmem:shmem_{T}_put"
    ],
    "slots": [
      {
        "kind": "buffer_slot",
        "name": "origin_buffer",
        "optional": false
      },
      {
        "kind": "buffer_slot",
        "name": "target_buffer",
        "optional": false
      },
      {
        "kind": "extent_slot",
        "name": "extent",
        "optional": false
      },
      {
        "kind": "selector_slot",
        "name": "target_selector",
        "optional": false
      }
    ],
    "template": {
      "data_flow": [
        {
          "buffer": "{{origin_buffer}}",